{
  "analysis_only": true,
  "approved_size": 0,
  "audit_checksum": "98a88396f5b2e5ffc1cde02435399540ad213f5ec361b33e8a19c08b0fedf1de",
  "code_commit": "a4501bb0d400c6c1b5cf970fc5aa6456ad8c6ea8",
  "config_checksum": "73f588b701176a23080dfc10ba30a79e60836db33242d3b23da48ef418e46fd9",
  "critical_divergence_count": 0,
  "execution_allowed": false,
  "external_connectivity_allowed": false,
  "lot34_audit_checksum": "cd4410a2ea9ef6cdc061caf5115d908d03575e219eb9f4da402bff1712f6c7ce",
  "lot34_state_checksum": "bc66816383ddf141016ad66796cc5dd4ad3442cd3594d96ad1f7db13d7c6bc01",
  "market_event_publication_allowed": false,
  "match_count": 2,
  "minor_divergence_count": 0,
  "network_ingestion_allowed": false,
  "order_routing_allowed": false,
  "raw_data_mutation_allowed": false,
  "real_credentials_allowed": false,
  "report_count": 3,
  "risk_approval_allowed": false,
  "schema_version": "candle-trade-book-reconciliation-audit-v1",
  "signal_generation_allowed": false,
  "state_output_checksum": "8fc7243beffdf985fd6947557b87ab7bd27f9191520eb2d5d9af25d1e7a886b4",
  "tolerated_diff_count": 1,
  "trade_allowed": false,
  "used_for_decision": false,
  "validation_state": "VALIDATED_RECONCILIATION_ONLY",
  "veto_action": "ALLOW_ANALYSIS"
}
